<?xml version="1.0" encoding="utf-8"?>
<Projects xmlns:xsi="http://www.w3.org/2001/XMLSchema-instance" xsi:schemaLocation=". hg-config.xsd">
	<Default>
		<!-- These are all default settings -->
		<Vars>
			<Branches>refs/heads/</Branches>
			<Tags>refs/tags/</Tags>
		</Vars>
		<!--
		Replace specification is applied to the path to replace
		names not allowed for refs. The following characters,
		though some of them legal in file names, are not allowed:
		
			Non-printable characters, space ' ', asterisk '*' , colon ':',
			question mark '?', left bracket '[', backslash '\',
			circumflex '^', tilde '~', and also '@{' sequence.
		
		Note that in XML, you don't need to escape a backslash,
		but need to escape some other special characters
		Replace specifications are applied in order of their appearance.
		
		Note that file pathnames are not affected by the
		ref replacement.
		
		You may need custom replacement specifications
		if default replacements create ambiguity (duplicating names).
		-->
		<!--<Replace>
			<Chars>path with spaces</Chars>
			<With>path_without_spaces</With>
		</Replace>-->
		<Replace>
			<!--
			This will replace spaces in the ref names
			with underscores
			-->
			<Chars> </Chars>
			<With>_</With>
		</Replace>
		<Replace>
			<Chars>:</Chars>
			<With>.</With>
		</Replace>
		<Replace>
			<Chars>^</Chars>
			<With>+</With>
		</Replace>
	</Default>
	<Project Name="*" Branch="*">
		<!--
		The default mappings are applied after non-default, for the given path.
		The default replacements are applied after non-default, for the given path.
		-->
		<!-- These are default mappings.
		An asterisk matches any path component (a string without path separator '/')
		A double asterisk matches any number of path components -
		any string with any number of path separators.
		$n are replacement strings, for the corresponding wildcards.
		-->
		<MapBranch>
			<!--
			"<branch>" will map to ref: "refs/heads/<branch>"
			-->
			<Branch>**</Branch>
			<Refname>${Branches}${1}</Refname>
		</MapBranch>
		<MapTag>
			<!--
			"<tag>" will map to ref: "refs/tags/<tag>"
			-->
			<Tag>**</Tag>
			<Refname>${Tags}${1}</Refname>
		</MapTag>

		<!--
		This will inject .editorconfig file to the root directory of each repo
		Default Yes.
		-->
		<InjectFile Path=".editorconfig"># Editor configuration file

# End .editorconfig scan at this directory level
root = true

[**]
charset = utf-8
indent_size = 4
tab_width = 4
insert_final_newline = true
trim_trailing_whitespace = true

[*.{c,cpp,h,hpp}]
indent_style = tab

[*.sh]
indent_style = tab
end_of_line = lf

[*.py]
indent_style = tab

[*.{xml}]
indent_style = tab
indent_size = 2
tab_width = 2

[*{M,m}akefile*]
# Recipe lines in a makefile are starting with a tab character
# Note that you better not use tabs to indent other lines, as it may confuse some versions of Make
indent_style = tab
# Trailing whitespace in makefiles has significance in some cases
trim_trailing_whitespace = false

</InjectFile>
		<!--
		This will inject .gitattributes file to the root directory of each new branch
		-->
		<InjectFile Path=".gitattributes">
*       text=auto
*.c     text
*.h     text
*.cpp   text
*.hpp   text
*.xml   text
*.dsp   text
*.dsw   text
*.vcxproj* text
*.pyproj text
*.exe   binary
*.a     binary
*.lib   binary
*.elf   binary
*.doc   binary
*.docx  binary
*.pdf   binary
*.png   binary
*.jpg   binary

*.sh    text eol=lf
</InjectFile>
		<InjectFile Path=".gitignore">*.o
*.o.d
*.suo
.vs/
.vscode/
.svn/
*~
*.obj
</InjectFile>
	</Project>
</Projects>
